{
  "schema_version": "1",
  "operation": "insert",
  "model": "orders",
  "idempotency_key": "integration-generated-field",
  "rows": [
    {
      "order_id": {"type": "integer", "value": 9000},
      "external_id": {"type": "text", "value": "integration-generated-field"},
      "customer_id": {"type": "integer", "value": 1},
      "ordered_at": {"type": "timestamp", "value": "2026-09-01T06:00:00Z"},
      "status": {"type": "text", "value": "paid"},
      "amount": {"type": "numeric", "value": "3.00"}
    }
  ]
}
