{
  "schema_version": "1",
  "operation": "insert",
  "model": "orders",
  "idempotency_key": "integration-order-insert",
  "rows": [
    {
      "external_id": {"type": "text", "value": "integration-order-conflict"},
      "customer_id": {"type": "integer", "value": 1},
      "ordered_at": {"type": "timestamp", "value": "2026-09-01T03:00:00Z"},
      "status": {"type": "text", "value": "paid"},
      "amount": {"type": "numeric", "value": "999.00"}
    }
  ]
}
