{
  "schema_version": "1",
  "operation": "upsert",
  "model": "orders",
  "idempotency_key": "commerce-example-order-1001-paid",
  "rows": [
    {
      "external_id": {
        "type": "text",
        "value": "example-order-1001"
      },
      "customer_id": {
        "type": "integer",
        "value": 1
      },
      "ordered_at": {
        "type": "timestamp",
        "value": "2026-09-01T09:00:00Z"
      },
      "status": {
        "type": "text",
        "value": "paid"
      },
      "amount": {
        "type": "numeric",
        "value": "42.50"
      }
    }
  ]
}
