{
  "schema_version": "1",
  "operation": "upsert",
  "model": "orders",
  "idempotency_key": "integration-order-upsert",
  "rows": [
    {
      "external_id": {"type": "text", "value": "integration-order-1"},
      "customer_id": {"type": "integer", "value": 2},
      "ordered_at": {"type": "timestamp", "value": "2026-09-01T01:02:03Z"},
      "status": {"type": "text", "value": "paid"},
      "amount": {"type": "numeric", "value": "70.50"}
    }
  ]
}
