{
  "schema_version": "1",
  "operation": "insert",
  "model": "tenant_orders",
  "idempotency_key": "integration-tenant-a-insert",
  "rows": [
    {
      "external_id": {"type": "text", "value": "integration-tenant-b-1"},
      "tenant_id": {"type": "text", "value": "tenant_b"},
      "amount": {"type": "numeric", "value": "28.50"}
    }
  ]
}
