{
  "schema_version": "1",
  "operation": "insert",
  "model": "orders",
  "idempotency_key": "integration-order-insert",
  "rows": [
    {
      "external_id": {"type": "text", "value": "integration-order-1"},
      "customer_id": {"type": "integer", "value": 2},
      "ordered_at": {"type": "timestamp", "value": "2026-09-01T01:02:03Z"},
      "status": {"type": "text", "value": "pending"},
      "amount": {"type": "numeric", "value": "64.25"}
    }
  ]
}
